{
  "id": "3",
  "term": "3",
  "status": "preferred",
  "usageNotes": [
    "431"
  ],
  "tags": [],
  "examples": {
    "good": [],
    "bad": []
  },
  "synonyms": [],
  "related": [],
  "sources": [],
  "createdAt": "2025-08-29T01:20:51.741Z",
  "updatedAt": "2025-08-29T01:20:51.741Z",
  "createdBy": "user",
  "updatedBy": "user"
}