{
  "id": "inclusive-language",
  "term": "inclusive language",
  "status": "preferred",
  "usageNotes": [
    "Use inclusive alternatives to gendered terms.",
    "Avoid idioms that may exclude."
  ],
  "tags": [
    "style"
  ],
  "examples": {
    "good": [
      "Use 'folks' instead of 'guys'."
    ],
    "bad": [
      "Hey guys, ..."
    ]
  },
  "synonyms": [
    "inclusive wording"
  ],
  "related": [
    "gender-neutral"
  ],
  "sources": [
    "https://styleguide.example.com/inclusive"
  ],
  "createdAt": "2025-01-01T12:00:00Z",
  "updatedAt": "2025-01-01T12:00:00Z",
  "createdBy": "octocat",
  "updatedBy": "octocat"
}